id,subreddit,weak_health_anxiety,preview
vms0sj,COVID19_support,0.725,"bathing when experiencing dizziness?

I've had covid for a few days, and I really feel like I need to shower or take a bath. However my biggest symptom is this killer headache that comes with dizziness. Would a hot showe"
1d7uvr9,COVID19_support,0.725,"Covid headache, any tips?

I've had a headache since yesterday and Tylenol barely helped. I tried peppermint and lavender oil on my scalp which helped a little but not much. Tried turmeric and ginger but they don't touch"
1t23sla,COVID19positive,0.7,"Hiding away from extended family

Not because we have tested positive… but because I can't be bothered with the demonising of the fact I tested. Both my hubs and I are on immune suppressants, so we have to test before ea"
1nmwnky,COVID19positive,0.7,"One month on - persistent headache, dizziness and fatigue

We caught Covid a month ago while on vacation in Ireland. We are vaccinated/boosted. This is our second infection after Omicron Dec 2021. It felt worse overall w"
i7djs1,COVID19positive,0.7,"Thought I was hungover..turned out to be COVID

I tested positive about three weeks ago. I felt hungover throughout the day--dizzy, headache and overall murky feeling. Later that night, I had chills, night sweats, and my"
1ncuf4s,COVID19positive,0.7,"Anyone else testing negative for covid but swear they have it??

I've had Covid 4 times in the past somehow… anyway at work these two guys traveled overseas for 3 weeks and came back extremely sick and didn't tell anyone"
1oedw9a,COVID19positive,0.7,"Dizziness and Headache

I don't have a test available to me, but I've had mild dizziness for a few days now, and a headache all day today. As well as fatigue. 

I'm wondering if anyone has had a Covid experience that sou"
1nquixl,COVID19positive,0.7,"Covid rash or paxlovid rash?

Hi I tested positive for covid and I am pregnant so I was given the antiviral for it, Paxlovid. Two doses into it (day 3 maybe 4 of illness when this happens- 24 hrs on Paxlovid) a rash arou"
1r2wnse,COVID19positive,0.7,"Headaches & Migraines

Hi all. Looking for anything really. I've had a covid headache for two weeks. Today it feels more migraine, it's on the right side of my head. It moves around from tension to right side to back to "
1pg3bok,COVID19positive,0.6975124378109452,"Headache between eyebrows, feeling run down, heavy chest and puffy feeling eyes

A few days ago I had some mild sneezing. Thought nothing of it. At dinner last night I felt dizzy and I couldn't concentrate at my desk/loo"
1s4zw0m,COVID19positive,0.6587155963302752,"COVID-19 Positive 3 Different Times

I have had COVID-19 3 different times. I had no fever, just a sore throat, runny nose, a bad cough and very bad fatigue really bad. The 2nd and 3rd time I have had COVID-19, I have ha"
w0is88,COVID19_support,0.6560344827586208,"Has anyone else noticed a deterioration in their eyesight after recovering from COVID?

I was sick for about two weeks (recovered a week ago). The first week was awful with respiratory and neurological symptoms - dizzine"
1ngxk02,COVID19positive,0.6246284501061571,"Dizziness for over a week leading up to virus

Hello. Im just wondering if anyone had these symptoms, first week in September I started getting random dizzy / lightheaded feelings , when I walked mostly. Kinda felt like "
1o90e36,COVID19positive,0.6115226337448559,"Fast heart rate/palpitations

Has anyone experienced a faster heart rate and palpitations when having Covid, I'm sure I've got Covid I done a test over a week ago when I first started feeling like this and it was negativ"
ozeqir,COVID19positive,0.6093567251461989,"I got the Delta Variant while being fully vaccinated.. here's how it's going

Day 1: severe headache, sensitivity to light, fever of 102.3. This is the day I was tested and came back positive. (Assumed migraine prior to "
1t7labw,Anxiety,0.6,"Anxiety dizziness or sleeping tablet?

So I've been experiencing a really scary on and off Falling/swaying/spinning off balance head sensation. I've had bloods tested, blood pressure checked, eyes checked and everything "
1su0cgj,Anxiety,0.6,"DIZZINESS

Anyone else experiencing dizziness that isn't vertigo or even really dizziness? 

It happens every day and it's like I'm walking on sand, or walking on a boat? It causes me to literally fear for my life and it"
1t5s1tz,Anxiety,0.6,"Hypochondriac, help me get thru this nightmare

Ever since I went to my grandma and was shoveling snow, i got back pain the day after and thats where it all started. Ever since that day i have nonstop worrying about gett"
1lkjpem,Anxiety,0.6,"Is anyone else hyper aware of any and all bodily sensations?

I've always been pretty aware of how I feel but since developing health anxiety I'm like HYPER aware of all sensations. I'm always feeling off, headache, cram"
1t8dzk6,Anxiety,0.6,"how do i stop my eye twitching

my eyes usually don't twitch for months. Maybe once a month? But for the last 1-2 days ,my left eye has been twitching alot. I have no idea what the cause might be because i have been slee"
